Identificacao;Data_remocao;Situacao;Descricao;Cidade;Distrito;Regiao;Fonte;Mapeamento_anterior;Justificativa;Observacao;Tipologia;Propriedade;Proprietario;Familias_ameacadas;Familias_removidas;Movimento;Zoneamento;Inicio_ocupacao;Endereco;Latitude;Longitude;Links;;;;;;;;;;;;;
MUNFORD;;AMEACA DE REMOCAO;A comunidade esta ameacada por estar localizada na faixa de dominio da Rodovia dos Imigrantes;DIADEMA;;ABC;Dados oficiais – Prefeitura de Diadema;SIM;FAIXA DE DOMINIO DE RODOVIA;;TERRENO VAZIO;PUBLICA;GOVERNO DO ESTADO;;;CMP;;;Rua Buenos Aires, 2 - Centro, Diadema - State of Sao Paulo, Brazil;-23.682554;-46.61099669999990;;;;;;;;;;;;;;
MUNIZ DE SOUZA;;AMEACA DE REMOCAO;Terreno ocupado por 88 familias corre risco de remocao. Se localiza na regiao de atuacao da Operacao Urbana Consorciada Bairros do Tamanduatei.;SAO PAULO;LIBERDADE;CENTRO;Dados oficiais – Habisp;SIM;PARCERIAS PUBLICO PRIVADAS;OUC Bairros do Tamanduatei;TERRENO VAZIO;PUBLICA;PREFEITURA;88;;;;;R. Uba, 1-9 - Cambuci, Sao Paulo - SP, 154-7, Brazil;-23.566332945302400;-46.625854023803700;;;;;;;;;;;;;;
MUZAMBINHO;;AMEACA DE REMOCAO;Terreno ocupado desde 1976 por 190 familias corre risco de remocao. Se localiza na regiao de atuacao da Operacao Urbana Consorciada Agua Espraiada, na area de implementacao da Via-Parque.;SAO PAULO;JABAQUARA;SUL 1;Dados oficiais – Habisp;SIM;PARCERIAS PUBLICO PRIVADAS;OUC Agua Espraiada;TERRENO VAZIO;PUBLICA;PREFEITURA;190;;;;;R. Dr. Alcides de Campos, 31 - Americanopolis, Sao Paulo - SP, 4336-16, Brazil;-23.662162969474400;-46.64098345648340;;;;;;;;;;;;;;
NACOES;;AMEACA DE REMOCAO;A comunidade esta ameacada por estar localizada na faixa de dominio da Rodovia dos Imigrantes;DIADEMA;;ABC;Dados oficiais – Prefeitura de Diadema;SIM;FAIXA DE DOMINIO DE RODOVIA;;TERRENO VAZIO;PUBLICA;GOVERNO DO ESTADO;;;CMP;;;Avenida Das Nacoes, 86 - Taboao, Diadema - State of Sao Paulo, Brazil;-23.6787432;-46.6115777;;;;;;;;;;;;;;
NAUTILUS;;AMEACA DE REMOCAO;Tem projeto (Complexo Cassaquera de urbanizacao) mas a verba foi cortada;SANTO ANDRE;;ABC;Dados oficiais – Secretaria de Habitacao Santo Andre;NAO;AREA DE RISCO;;TERRENO VAZIO;;;35;;;;;R. Nautilus / R. Laplace;-23.6971008;-46.4978857;;;;;;;;;;;;;;
NOSSA SENHORA ASSUNCAO I;;AMEACA DE REMOCAO;Terreno ocupado por comunidade desde 1960 corre ameaca de remocao de suas 352 familias. A ocupacao se localiza em perimetro do projeto Renova SP.;SAO PAULO;RIO PEQUENO;OESTE;Dados oficiais – Habisp;SIM;URBANIZACAO DE FAVELAS;;TERRENO VAZIO;PUBLICA;PREFEITURA;352;;;;;;-23.571913569653148;-46.74616611957401;;;;;;;;;;;;;;
NOSSA SENHORA ASSUNCAO II;;AMEACA DE REMOCAO;Terreno ocupado por comunidade desde 1960 corre ameaca de remocao de suas 150 familias. A ocupacao se localiza em perimetro do projeto Renova SP.;SAO PAULO;RIO PEQUENO;OESTE;Dados oficiais – Habisp;SIM;URBANIZACAO DE FAVELAS;;TERRENO VAZIO;PUBLICA;PREFEITURA;150;;;;;;-23.571150120960326;-46.74720781534427;;;;;;;;;;;;;;
NOSSA SENHORA ASSUNCAO III;;AMEACA DE REMOCAO;Favela listada no banco de dados do Habitasampa e classificada como area de risco nivel 3 e/ou 4.;SAO PAULO;RIO PEQUENO;OESTE;Dados oficiais – Habitasampa;NAO;AREA DE RISCO;Deslizamento / Solapamento;TERRENO VAZIO;;;12;;;ZEIS-1 | ZM;1972;Rua Francisco Vilaca;-23.5716852935882;-46.746056835595;;;;;;;;;;;;;;
NOVA CENTREVILLE;;AMEACA DE REMOCAO;Tem projeto de urbanizacao, mas esta paralisado;SANTO ANDRE;;ABC;Dados oficiais – Secretaria de Habitacao Santo Andre;NAO;URBANIZACAO DE FAVELAS;;TERRENO VAZIO;;;7;;;;;Av. Valentim Magalhaes / Rua Miguel Calmon;-23.6762257;-46.4984243;;;;;;;;;;;;;;
NOVA FAVELA DO SAPO;;AMEACA DE REMOCAO;A situacao das familias e de alto risco, por viverem em cima do corrego Agua Branca, e medidas como remocao e atendimento dessas familias estao sendo discutidas nas reunioes do Conselho Gestor da Operacao.;SAO PAULO;BARRA FUNDA;OESTE;Dados oficiais – Habisp;SIM;PARCERIAS PUBLICO PRIVADAS;OUC Agua Branca;TERRENO VAZIO;PUBLICA;PREFEITURA;168;;;;;R. Jose Nelo Lorenzon, 2-58 - Agua Branca, Sao Paulo - SP, 537-5, Brazil;-23.514111922973000;-46.68620021914060;;;;;;;;;;;;;;
NOVA GRAJAU I E II;;AMEACA DE REMOCAO;Favela listada no banco de dados do Habitasampa e classificada como area de risco nivel 3 e/ou 4.;SAO PAULO;GRAJAU;SUL 2;Dados oficiais – Habitasampa;NAO;AREA DE RISCO;Deslizamento / Solapamento;TERRENO VAZIO;PUBLICA;PREFEITURA;65;;;ZEIS-1 | ZEPAM | ZEUPa | ZMa;1978;Rua Manoel Guilherme dos Reis;-23.7473877816334;-46.6833963812551;;;;;;;;;;;;;;
NOVA JERUSALEM;;AMEACA DE REMOCAO;;SAO PAULO;IGUATEMI;LESTE 2;Denuncia via parceiros do Observatorio de Remocoes;NAO;REINTEGRACAO DE POSSE;;TERRENO VAZIO;PRIVADA;;400;;;;;Rua Anecy Rocha - Iguatemi - Sao Mateus;-23.60478;-46.43787;;;;;;;;;;;;;;
NOVA SERRANA;;AMEACA DE REMOCAO;A comunidade esta ameacada por estar localizada na faixa de dominio da Rodovia dos Imigrantes;DIADEMA;;ABC;Dados oficiais – Prefeitura de Diadema;SIM;FAIXA DE DOMINIO DE RODOVIA;;TERRENO VAZIO;PUBLICA;GOVERNO DO ESTADO;;;CMP;;;Rua Serra Uassari, 12 - Campanario, Diadema - State of Sao Paulo, Brazil;-23.6743338;-46.6264913;;;;;;;;;;;;;;
NOVA TUPAROQUEIRA;;AMEACA DE REMOCAO;;SAO PAULO;JARDIM SAO LUIS;SUL 2;Denuncia via parceiros do Observatorio de Remocoes;NAO;REINTEGRACAO DE POSSE;;TERRENO VAZIO;PUBLICA;;;;;;;R. Nova do Tuparoquera, 239;-23.666014;-46.7469651;;;;;;;;;;;;;;
NOVE DE JULHO;;AMEACA DE REMOCAO;Ameaca de remocao acompanhada pelo Nucleo de Mediacao de Conflitos da Secretaria Municipal de Habitacao de Sao Paulo.;SAO PAULO;REPUBLICA;CENTRO;Dados oficiais - Nucleo de Mediacao de Conflitos da Secretaria Municipal de Habitacao - Sao Paulo;NAO;REINTEGRACAO DE POSSE;;EDIFICACAO;PUBLICA;;121;;FLM;ZEIS-3;;Avenida Nove de Julho, 584, Se, Sao Paulo, SP, Brasil;-23.5503195;-46.6441136;;;;;;;;;;;;;;
NUCLEO PIRATININGA;;AMEACA DE REMOCAO;A comunidade esta ameacada por estar localizada na faixa de dominio da Rodovia dos Imigrantes;DIADEMA;;ABC;Dados oficiais – Prefeitura de Diadema;SIM;FAIXA DE DOMINIO DE RODOVIA;;TERRENO VAZIO;PUBLICA;GOVERNO DO ESTADO;60;;CMP;;;Rua Francisco Antonio da Silva, 57 - Serraria, Diadema - State of Sao Paulo, Brazil;-23.6975599;-46.60317829999990;;;;;;;;;;;;;;
OCUPA COHAB ADVENTISTA;;AMEACA DE REMOCAO;Ordem de reintegracao de posse ja foi expedida. As entidades selecionadas para ocuparem os imoveis do empreendimento foram MOHAS (Movimento Habitacional e Acao Social) e a Associacao Comunitaria Rosa Luxemburgo.;SAO PAULO;CAPAO REDONDO;SUL 2;Denuncia via parceiros do Observatorio de Remocoes;NAO;REINTEGRACAO DE POSSE;;TERRENO VAZIO;PUBLICA;COHAB;200;;FLM;;;Rua dos Mutirantes, nº 16 - COHAB Adventista;-23.67017;-46.77819;"<p style=""font-size: 13px; font-weight: normal; margin: 5px; color: #4A4A4A;"">     <a href=""http://www.prefeitura.sp.gov.br/cidade/secretarias/upload/habitacao/Solicitao_de_voto_CECMH_03_2016_6_GESTO_R1.pdf"" target=""_blank""style=""font-weight: bold; color: #1CAAD9;"">Clique aqui para ler mais</a>";;;;;;;;;;;;;
OCUPACAO ARMENIA;;AMEACA DE REMOCAO;O imovel ficou desocupado por mais de 10 anos.;SAO PAULO;BOM RETIRO;CENTRO;Denuncia via parceiros do Observatorio de Remocoes;NAO;REINTEGRACAO DE POSSE;;TERRENO VAZIO;PRIVADA;;51;;FLM;;;Rua Victor Ayrosa,31;-23.52849;-46.62642;;;;;;;;;;;;;;
OCUPACAO BELA VISTA/VILA PROGRESSO;;AMEACA DE REMOCAO;Caso a liminar seja mantida, a reintegracao de posse da ocupacao estara marcada para o dia 14 de junho de 2018. A area e da prefeitura, que diz que o terreno apresenta risco de deslizamento, mas tal pronuncia e questionada pelos movimentos de moradia. A area e tambem Zona de Protecao Paisagistica. ;SANTOS;;LITORAL;Denuncia via Whatsapp;NAO;AREA DE RISCO;;TERRENO VAZIO;PRIVADA;;60;;;;;Tv. Um, 2-18;-23.938595;-46.353021;"<p style=""font-size: 13px; font-weight: normal; margin: 5px; color: #4A4A4A;"">     <a href=""http://ontonrtv.blogspot.com.br/2018/05/prefeitura-de-santos-prepara-mega.html"" target=""_blank""style=""font-weight: bold; color: #1CAAD9;"">Clique aqui para ler mais</a>";;;;;;;;;;;;;
OCUPACAO CANINDE;;AMEACA DE REMOCAO;A ocupacao se iniciou em julho de 2010. A ordem de reintegracao de posse ja foi expedida, porem a reuniao no Batalhao da Policia Militar foi adiada devido ao nao comparecimento do advogado do proprietario. A data para a reintegracao estava marcada para o mes de julho de 2017.;SAO PAULO;PARI;LESTE 1;Denuncia via parceiros do Observatorio de Remocoes;NAO;REINTEGRACAO DE POSSE;;EDIFICACAO;PRIVADA;;48;;;;;Rua Caninde, 559;-23.52963;-46.6229;"<p style=""font-size: 13px; font-weight: normal; margin: 5px; color: #4A4A4A;"">     <a href=""http://www.tjsp.jus.br/Noticias/Noticia?codigoNoticia=40579"" target=""_blank""style=""font-weight: bold; color: #1CAAD9;"">Clique aqui para ler mais</a>";;;;;;;;;;;;;
OCUPACAO CASA AMARELA QUILOMBO AFROGUARANY;;AMEACA DE REMOCAO;Artistas e familias moradoras dividem espaco no terreno com numero 1075, 1047 e 1059 e estao com a quarta reintegracao de posse aberta contra a ocupacao;SAO PAULO;CONSOLACAO;CENTRO;Clipping;NAO;REINTEGRACAO DE POSSE;;EDIFICACAO;PUBLICA;PREFEITURA;;;Quilombo Vivo;;;Rua da Consolacao, 175;-23.548879;-46.651587;;;;;;;;;;;;;;
OCUPACAO CHACARA DO CONDE;;AMEACA DE REMOCAO;Terreno ocupado por comunidade desde 2015 corre ameaca de remocao de suas 84 familias.;SAO PAULO;GRAJAU;SUL 2;Denuncia via parceiros do Observatorio de Remocoes;SIM;REINTEGRACAO DE POSSE;;TERRENO VAZIO;PUBLICA;PREFEITURA;84;;FLM;;;Rua Constelacao do Caranguejo, 52;-23.7694478;-46.70564239999990;;;;;;;;;;;;;;
OCUPACAO DA ALCANTARA;;AMEACA DE REMOCAO;No dia 10/12/2015, um processo de reintegracao de posse foi iniciado. Os moradores se recusaram a sair do local e fizeram barricadas para impedir o acesso. A ocupacao Alcantara e muito parecida com a ocupacao do Cimento. A Tenda ao lado da Comunidade (servico da Assistencia para populacao de rua) foi fechada e esta ocupada pelos ex-trabalhadores e pela populacao de rua, como tentativa de garantir o atendimento e reivindicando outro espaco para continuar o trabalho, proximo dali, alem de um atendimento melhor em relacao a moradia.;SAO PAULO;BELEM;LESTE 1;Denuncia via parceiros do Observatorio de Remocoes;SIM;REINTEGRACAO DE POSSE;;TERRENO VAZIO;PUBLICA;PREFEITURA;30;;Coletivo Autonomo dos Trabalhadores Sociais (CATSO);;;Av. Alcantara Machado, 888 - Bras, Sao Paulo - SP, Brazil;-23.5423246;-46.582845599999900;"<p style=""font-size: 13px; font-weight: normal; margin: 5px; color: #4A4A4A;"">     <a href=""http://vaidape.com.br/2017/03/a-historia-da-tenda-alcantara-machado/"" target=""_blank""style=""font-weight: bold; color: #1CAAD9;"">Clique aqui para ler mais</a>";;;;;;;;;;;;;
OCUPACAO DOUGLAS RODRIGUES;;AMEACA DE REMOCAO;Terreno ocupado por 2500 familias esta penhorado pela Uniao e tem passado por disputa pela reintegracao de posse entre o governo federal e o Tribunal de Justica, com resistencia da comunidade.;SAO PAULO;VILA MARIA;NORTE 1;Denuncia via parceiros do Observatorio de Remocoes;SIM;REINTEGRACAO DE POSSE;;TERRENO VAZIO;PRIVADA;;2500;;UMM;;;R. Manguari, 252 - Jardim Andarai, Sao Paulo - SP, Brazil;-23.52405947687390;-46.57997508385310;;;;;;;;;;;;;;
OCUPACAO EDIFICIO PEIXOTO GOMIDE;;AMEACA DE REMOCAO;No dia 11 de julho de 2017, um mandado de reintegracao de posse foi expedido pela Justica em favor da Santa Alice Hotelaria e Construcoes, empresa que desde 2004 tem sete das nove moradias do predio. Apos reintegracao, os moradores voltaram a ocupar o predio.;SAO PAULO;JARDIM PAULISTA;CENTRO;Clipping;NAO;REINTEGRACAO DE POSSE;;EDIFICACAO;PRIVADA;;30;;;;;Rua Oscar Freire, 178;-23.5675584;-46.663940000000000;"<p style=""font-size: 13px; font-weight: normal; margin: 5px; color: #4A4A4A;""> <a href=""http://www1.folha.uol.com.br/cotidiano/2017/07/1901712-estrangeiros-na-oscar-freire-sem-teto-terao-que-deixar-predio-invadido.shtml"" target=""_blank""style=""font-weight: bold; color: #1CAAD9;"">Clique aqui para ler mais</a>";;;;;;;;;;;;;
OCUPACAO ELZA DE GUIMARAES;;AMEACA DE REMOCAO;Ocupacao teve inicio em outubro de 2016. O terreno pertence a COHAB e permaneceu abandonada ha mais de 30 anos. A ocupacao esteve ameacada de reintegracao de posse marcada para o dia 05/07/2017, mas os moradores conseguiram um acordo de mais 6 meses para ficar na area.;SAO PAULO;CACHOEIRINHA;NORTE 2;Clipping;NAO;REINTEGRACAO DE POSSE;;TERRENO VAZIO;PUBLICA;PREFEITURA;110;;FLM;;;Rua Elza Guimaraes;-23.468678;-46.651312;"<p style=""font-size: 13px; font-weight: normal; margin: 5px; color: #4A4A4A;"">     <a href=""http://www.tvt.org.br/moradores-de-ocupacao-em-lauzane-paulista-conseguem-mais-6-meses/"" target=""_blank""style=""font-weight: bold; color: #1CAAD9;"">Clique aqui para ler mais</a>";;;;;;;;;;;;;
OCUPACAO FRANCISCO ALVARES;;AMEACA DE REMOCAO;Favela listada no banco de dados do Habitasampa e classificada como area de risco nivel 3 e/ou 4.;SAO PAULO;VILA CURUCA;LESTE 2;Dados oficiais – Habitasampa;NAO;AREA DE RISCO;Deslizamento / Solapamento;TERRENO VAZIO;;;5;;;ZM;2008;Rua Francisco Alvares Correia;-23.509934644299;-46.4037936139295;;;;;;;;;;;;;;
OCUPACAO IMIRIM;;AMEACA DE REMOCAO;Ocupado desde fevereiro de 2014, as familias ocuparam a area apos serem removidas de outra ocupacao que havia gas metano, entao o abandonaram. As familias estao inscritas em programas habitacionais. O terreno e da COHAB, que desapropriou o terreno para a implantacao de Programa Habitacional - Aida Gomes. Uma liminar de reintegracao de posse de 2014, que fora interposta por recurso de agravo, foi tornada definitiva em 17 de julho de 2017.  Processo nº 1007673.39.2014.8.20.0001;SAO PAULO;CACHOEIRINHA;NORTE 2;Clipping;NAO;REINTEGRACAO DE POSSE;;TERRENO VAZIO;PUBLICA;PREFEITURA;194;;FLM;;;Rua Atlantico Meridional, 82;-23.47699;-46.65807;;;;;;;;;;;;;;
OCUPACAO IQ 2014;;AMEACA DE REMOCAO;Favela listada no banco de dados do Habitasampa e classificada como area de risco nivel 3 e/ou 4.;SAO PAULO;PARQUE DO CARMO;LESTE 2;Dados oficiais – Habitasampa;NAO;AREA DE RISCO;Deslizamento / Solapamento;TERRENO VAZIO;;;70;;;ZMa | ZEIS-1;2014;Rua Zenobio Acioli x Rua Lopes de Medeiros;-23.5709959570252;-46.4820547556559;;;;;;;;;;;;;;
OCUPACAO JARDIM DA UNIAO;;AMEACA DE REMOCAO;A area, ocupada por 600 familias, pertence a Companhia Metropolitana de Habitacao (Cohab), do governo estadual. Reintegracao de posse, solicitada pela Cohab, esta suspensa temporariamente.;SAO PAULO;GRAJAU;SUL 2;Denuncia via parceiros do Observatorio de Remocoes;SIM;REINTEGRACAO DE POSSE;;TERRENO VAZIO;PUBLICA;GOVERNO DO ESTADO;600;;Rede Extremo Sul;;;R. Boa Vista, 166-182 - Cantinho do Ceu, Sao Paulo - SP, 4849-61, Brazil;-23.741375249527600;-46.65767213558190;;;;;;;;;;;;;;
OCUPACAO MANDELINHA;;AMEACA DE REMOCAO;A ocupacao e em uma area que seria destinada a producao habitacional MCMV, terreno de posse do Banco do Brasil, porem ha cinco anos que a obra esta parada. Apos muita luta, os moradores conseguiram barrar a reintegracao de posse.;COTIA;;RMSP;Denuncia via formulario online;NAO;OBRAS PUBLICAS;;TERRENO VAZIO;PUBLICA;GOVERNO FEDERAL;450;;ANM - Associacao por Moradia Nelson Mandela;;;Estrada Velha da Olaria, 2715 - Jardim Arco-Iris, Cotia - State of Sao Paulo, Brazil;-23.6180244;-46.9357675;;;;;;;;;;;;;;
OCUPACAO MARIELLE FRANCO;;AMEACA DE REMOCAO;Teve inicio dia 24 de abril de 2018, uma semana antes do incendio na ocupacao no Centro de Sao Paulo. Cerca de 2000 familias filiadas ao MTST ocuparam um terreno na Avenida Teotonio Vilela 6400, no Grajau. O proprietario do terreno particular entrou com um pedido de reintegracao de posse mas, no dia 11 de maio, a Brigada Juridica do MTST conseguiu uma liminar para frear o processo.;SAO PAULO;CIDADE DUTRA;SUL 2;Clipping;NAO;REINTEGRACAO DE POSSE;;TERRENO VAZIO;PRIVADA;;2000;;MTST;;;Av. Teotonio Vilela, 64 - Grajau;-23.753273;-46.711365;;;;;;;;;;;;;;
OCUPACAO MAUA;;AMEACA DE REMOCAO;No dia 22 de outubro de 2017, o juiz suspendeu a reintegracao de posse no edificio Maua, que havia sido solicitada pelo proprietario do edificio que resistia ao acordo de compra do predio. A ideia e que o edificio seja usado para moradia social da COHAB e que os moradores do edificio tenham prioridade na fila de habitacao. ;SAO PAULO;REPUBLICA;CENTRO;Clipping;NAO;REINTEGRACAO DE POSSE;;EDIFICACAO;PRIVADA;;237;;MMLJ;;;Rua Maua, 34 - Centro, Săo Paulo - State of Săo Paulo, Brazil;-23.535173;-46.6366146999999;"<p style=""font-size: 13px; font-weight: normal; margin: 5px; color: #4A4A4A;"">     <a href=""https://ponte.org/justica-suspende-reintegracao-de-posse-da-ocupacao-maua/"" target=""_blank""style=""font-weight: bold; color: #1CAAD9;"">Clique aqui para ler mais</a>";;;;;;;;;;;;;
OCUPACAO NO SITIO JARAGUA;;AMEACA DE REMOCAO;Obras paradas da Rodovia Ananhanguera;SAO PAULO;SAO DOMINGOS;NORTE 2;Denuncia via parceiros do Observatorio de Remocoes;NAO;REINTEGRACAO DE POSSE;;TERRENO VAZIO;;;;;;;;Rua Renato Consorte, s/n - Jaragua;-23.47471;-46.75998;;;;;;;;;;;;;;
OCUPACAO NOVE DE JULHO;;AMEACA DE REMOCAO;Apos o incendio do Largo Paissandu, os moradores estao ameacados de serem removidos do edificio apos a decisao de vistoria dos imoveis na area central, que interditara os que possam estar com a seguranca comprometida. A rede de apoio a ocupacao mobilizou engenheiros e arquitetos que podiam oferecer um laudo tecnico e devidas orientacoes para tentar previamente diminuir o risco de acidentes no edificio.;SAO PAULO;REPUBLICA;CENTRO;Clipping;NAO;REINTEGRACAO DE POSSE;;EDIFICACAO;PUBLICA;GOVERNO FEDERAL;121;;FLM;;;Rua Alvaro de Carvalho, 427 - Centro;-23.549539;-46.644165;;;;;;;;;;;;;;
OCUPACAO OUVIDOR 63;;AMEACA DE REMOCAO;"A ocupacao esta em processo de reintegracao de posse – o imovel pertence ao governo do estado. Em fevereiro de 2018, a Justica expediu um mandado de execucao da reintegracao, mas o fato ainda nao foi concretizado. ""Falamos com os promotores e nos prometeram que vai ser revisto. Nao e um cenario muito bacana agora para que aconteca essas reintegracoes"", explica morador, falando sobre a tragedia do Largo Paissandu no dia 01 de maio de 2018.";SAO PAULO;SE;CENTRO;Clipping;NAO;REINTEGRACAO DE POSSE;;EDIFICACAO;PUBLICA;GOVERNO DO ESTADO;40;;;;;Rua do Ouvidor, 63;-23.549291;-46.638222;"<p style=""font-size: 13px; font-weight: normal; margin: 5px; color: #4A4A4A;"">     <a href=""http://www.redebrasilatual.com.br/revistas/140/ouvidor-63-a-arte-como-instrumento-de-inclusao-social-e-luta-por-moradia"" target=""_blank""style=""font-weight: bold; color: #1CAAD9;"">Clique aqui para ler mais</a>";;;;;;;;;;;;;
OCUPACAO POLO CULTURAL;;AMEACA DE REMOCAO;Favela listada no banco de dados do Habitasampa e classificada como area de risco nivel 3 e/ou 4.;SAO PAULO;PONTE RASA;LESTE 2;Dados oficiais – Habitasampa;NAO;AREA DE RISCO;Deslizamento / Solapamento;TERRENO VAZIO;;;2;;;ZC;2000;Avenida Aguia de Haia;-23.5169772160701;-46.4768917830738;;;;;;;;;;;;;;
OCUPACAO QUINTINO BOCAIUVA;;AMEACA DE REMOCAO;O imovel foi ocupado em no dia 28 de outubro de 2012 por familias ligadas ao movimento FLM. O imovel e tombado.;SAO PAULO;SE;CENTRO;Denuncia via parceiros do Observatorio de Remocoes;NAO;REINTEGRACAO DE POSSE;;EDIFICACAO;PRIVADA;;35;;FLM;;;Rua Quintino Bocaiuva, 242;-23.5508;-46.63545;;;;;;;;;;;;;;
OCUPACAO RIO BRANCO 1;;AMEACA DE REMOCAO;A ocupacao teve a luz cortada apos o incendio no edificio Paissandu no dia 01 de maio de 2018.;SAO PAULO;REPUBLICA;CENTRO;Clipping;NAO;REINTEGRACAO DE POSSE;;EDIFICACAO;PRIVADA;;83;;FLM;;;Avenida Rio Branco, 53 - Campos Eliseos, Sao Paulo - State of Sao Paulo, Brazil;-23.542098;-46.638398;;;;;;;;;;;;;;
OCUPACAO RIO BRANCO 2;;AMEACA DE REMOCAO;Ameaca das 120 familias residentes no edificio.;SAO PAULO;REPUBLICA;CENTRO;Denuncia via parceiros do Observatorio de Remocoes;SIM;REINTEGRACAO DE POSSE;;EDIFICACAO;PRIVADA;;120;;FLM;;;Avenida Rio Branco, 47 - Campos Eliseos, Sao Paulo - State of Sao Paulo, Brazil;-23.542271;-46.638349500000000;;;;;;;;;;;;;;
OCUPACAO TERRA BOA;;AMEACA DE REMOCAO;Ha mais de dois anos mais de 80 Familias da Ocupacao Condominio Terra Boa ocuparam o terreno comprado pela prefeitura de Sao jose dos Campos para a construcao de empreendimento habitacional, mas uma area de 30 mil metros quadrados ficou abandonada, com historico de violencia sexual no terreno, segundo moradores. O despejo esta marcado para o dia 04/06/2018.  Processo: 1011202-45.2018.8.26. 0577;SAO JOSE DOS CAMPOS;;INTERIOR;Denuncia via formulario online;NAO;REINTEGRACAO DE POSSE;;TERRENO VAZIO;PUBLICA;PREFEITURA;80;;CMP;;;Rua Jose Borges Sobrinho, 155;-23.160633;-45.924526;"<p style=""font-size: 13px; font-weight: normal; margin: 5px; color: #4A4A4A;"">     <a href=""http://www.jubileusul.org.br/nota/4991"" target=""_blank""style=""font-weight: bold; color: #1CAAD9;"">Clique aqui para ler mais</a>";;;;;;;;;;;;;
OCUPACAO TERRA PROMETIDA;;AMEACA DE REMOCAO;Ocupacao de 286 familias em area aproximada de 15mil m2, organizada pela associacao de luta e defesa dos direitos dos moradores do jardim catarina e pela unificacao das lutas de corticos (ULC). As familias estao desde 15 de outubro na area devido ao grande deficit habitacional e alta dos alugueis.;SAO PAULO;ARICANDUVA;LESTE 1;Denuncia via parceiros do Observatorio de Remocoes;NAO;REINTEGRACAO DE POSSE;;TERRENO VAZIO;PUBLICA;GOVERNO FEDERAL;286;;Associacao de luta e defesa dos direitos dos moradores do jardim catarina;;;Rua Rufino Fernandes Inivarri, 121 - Conjunto Habitacional Barreira Grande, Sao Paulo ;-23.5887462;-46.50696270000000;;;;;;;;;;;;;;
ODASSI NAZZALI;;AMEACA DE REMOCAO;Favela listada no banco de dados do Habitasampa e classificada como area de risco nivel 3 e/ou 4.;SAO PAULO;CACHOEIRINHA;NORTE 2;Dados oficiais – Habitasampa;NAO;AREA DE RISCO;Deslizamento / Solapamento;TERRENO VAZIO;PUBLICA;PREFEITURA;68;;;ZEIS-1 | ZC | ZM;1980;Rua Odassi Nazzali;-23.4683302891262;-46.6610948606744;;;;;;;;;;;;;;
OKINAWA;;AMEACA DE REMOCAO;Integra um projeto de urbanizacao de favelas com diversas areas que esta paralisado - Demarcado como area consolidavel com remocao pela PMSA;SANTO ANDRE;;ABC;Dados oficiais – Secretaria de Habitacao Santo Andre;NAO;URBANIZACAO DE FAVELAS;;TERRENO VAZIO;;;8;;;;;R. Okinawa ;-23.68193;-46.53197;;;;;;;;;;;;;;
OLARIA;;AMEACA DE REMOCAO;Terreno ocupado por comunidade desde 1960 corre ameaca de remocao de suas 264 familias. ;SAO PAULO;CAMPO LIMPO;SUL 2;Pesquisas de campo do Observatorio de Remocoes;NAO;PARCERIAS PUBLICO PRIVADAS;PIU Arco Jurubatuba;TERRENO VAZIO;PUBLICA;PREFEITURA;264;;;;;Rua Taboas, 5 - Parque Reboucas, Sao Paulo - SP, Brazil;-23.62382194933930;-46.74715844232780;;;;;;;;;;;;;;
OLIVEIRA MARTINS;;AMEACA DE REMOCAO;Favela listada no banco de dados do Habitasampa e classificada como area de risco nivel 3 e/ou 4.;SAO PAULO;CACHOEIRINHA;NORTE 2;Dados oficiais – Habitasampa;NAO;AREA DE RISCO;Deslizamento / Solapamento;TERRENO VAZIO;PRIVADA;;29;;;ZEIS-1 | ZM | ZC;1974;Rua Oliveira Martins 58;-23.4678396693294;-46.6619185674062;;;;;;;;;;;;;;
ORATORIO;;AMEACA DE REMOCAO;Area demarcada como nao consolidavel por motivo de risco geotecnico - sem projeto;MAUA;;ABC;Dados oficiais – Secretaria de Habitacao Santo Andre;SIM;AREA DE RISCO;;TERRENO VAZIO;;;77;;;;;R. Aurora, 48 - Jardim Ana Maria, Maua - SP, Brazil;-23.62373;-46.48702;;;;;;;;;;;;;;
ORESTE DAMOLIN;;AMEACA DE REMOCAO;Favela listada no banco de dados do Habitasampa e classificada como area de risco nivel 3 e/ou 4.;SAO PAULO;SAPOPEMBA;LESTE 2;Dados oficiais – Habitasampa;NAO;AREA DE RISCO;Deslizamento / Solapamento;TERRENO VAZIO;PUBLICA;PREFEITURA;60;;;ZEIS-1 | ZMIS;1994;Rua Oreste Damolin;-23.6010823066764;-46.4972217814418;;;;;;;;;;;;;;
OSVALDO CRUZ;;AMEACA DE REMOCAO;Integra um projeto de urbanizacao de favelas com diversas areas que esta paralisado - Demarcado como area consolidavel com remocao pela PMSA;SANTO ANDRE;;ABC;Dados oficiais – Secretaria de Habitacao Santo Andre;NAO;AREA DE RISCO;;TERRENO VAZIO;;;8;;;;;R. Oswaldo Cruz;-23.6830105;-46.53430739999999;;;;;;;;;;;;;;
PACHECO CHAVES;;AMEACA DE REMOCAO;Terreno ameacado pelo OUCBT;SAO PAULO;VILA PRUDENTE;SUL 1;Dados oficiais – Habisp;SIM;PARCERIAS PUBLICO PRIVADAS;OUC Bairros do Tamanduatei;TERRENO VAZIO;PUBLICA;PREFEITURA;;;;;;R. Ilha Serigipe, 13 - Vila Prudente, Sao Paulo - SP, Brazil;-23.581898804850900;-46.59592806627050;;;;;;;;;;;;;;
PADRE DONIZETI;;AMEACA DE REMOCAO;Area demarcada como nao consolidavel pela PMSA - sem projeto;SANTO ANDRE;;ABC;Dados oficiais – Secretaria de Habitacao Santo Andre;NAO;URBANIZACAO DE FAVELAS;;TERRENO VAZIO;;;120;;;;;R. Padre Donizeti / R. Sarg. Silvio Delmar Rollemback;-23.6758621;-46.4958337;;;;;;;;;;;;;;
PADRE LEAO PERUCHE;;AMEACA DE REMOCAO;Favela listada no banco de dados do Habitasampa e classificada como area de risco nivel 3 e/ou 4.;SAO PAULO;TUCURUVI;NORTE 1;Dados oficiais – Habitasampa;NAO;AREA DE RISCO;Deslizamento / Solapamento;TERRENO VAZIO;PUBLICA;PREFEITURA;18;;;ZEIS-1 | ZEU;1979;Rua Padre Leao Peruche 466 / Avenida Doutor Antonio Maria Laet;-23.4765413034519;-46.6012975978663;;;;;;;;;;;;;;
PAIO;;AMEACA DE REMOCAO;Proposta de expropriacao judicial. O Centro Gaspar Garcia tem o processo de usucapiao.;SAO PAULO;CIDADE TIRADENTES;LESTE 2;Informacoes obtidas nas oficinas territoriais;NAO;REINTEGRACAO DE POSSE;;TERRENO VAZIO;PRIVADA;;1000;;;;;Rua Inacio Monteiro;-23.57979;-46.38947;;;;;;;;;;;;;;
PAIOLZINHO 1;;AMEACA DE REMOCAO;Ameaca de remocao acompanhada pelo Nucleo de Mediacao de Conflitos da Secretaria Municipal de Habitacao de Sao Paulo.;SAO PAULO;CIDADE TIRADENTES;LESTE 2;Dados oficiais - Nucleo de Mediacao de Conflitos da Secretaria Municipal de Habitacao - Sao Paulo;NAO;REINTEGRACAO DE POSSE;;TERRENO VAZIO;PRIVADA;;500;;;ZEIS-1;2002;Rua Inacio Monteiro, 63, Cidade Tiradentes, Sao Paulo, SP, Brasil;-23.5760682;-46.3923918;;;;;;;;;;;;;;
