Identificacao;Data_remocao;Situacao;Descricao;Cidade;Distrito;Regiao;Fonte;Mapeamento_anterior;Justificativa;Observacao;Tipologia;Propriedade;Proprietario;Familias_ameacadas;Familias_removidas;Movimento;Zoneamento;Inicio_ocupacao;Endereco;Latitude;Longitude;Links;;;;;;;;;;;;;
JD. SANTA EFIGENIA/CAMPO LIMPO;;AMEACA DE REMOCAO;;SAO PAULO;JARDIM SAO LUIS;SUL 2;Dados oficiais - Defensoria Publica de Santo Amaro;NAO;REINTEGRACAO DE POSSE;;;PUBLICA;PAULO Y. KAHARA;7;;;;;R. Lira Cearense, n. 99, Campo Limpo - Sao Paulo/SP;-23.6626479549274;-46.7579874200585;;;;;;;;;;;;;;
FAVELA FUMACA - BILINGS (EMAE);;AMEACA DE REMOCAO;;SAO PAULO;GRAJAU;SUL 2;Dados oficiais - Defensoria Publica de Santo Amaro;NAO;REINTEGRACAO DE POSSE;;TERRENO VAZIO;PUBLICA;EMAE;550;;;;;Estrada do Alvarenga, junto ao n. 3970 e proximo ao Parque Doroteia - Sao Paulo/SP;-23.7773382135273;-46.7070175952743;;;;;;;;;;;;;;
SUCUPIRA;;AMEACA DE REMOCAO;;SAO PAULO;CAMPO LIMPO;SUL 2;Dados oficiais - Defensoria Publica de Santo Amaro;NAO;REINTEGRACAO DE POSSE;;TERRENO VAZIO;PRIVADA;EMAE;5000;;;;;Av. Belmira Marin, 3.000;-23.6410279248065;-46.7610273600658;;;;;;;;;;;;;;
COCAIA;;AMEACA DE REMOCAO;;SAO PAULO;PEDREIRA;SUL 2;Dados oficiais - Defensoria Publica de Santo Amaro;NAO;REINTEGRACAO DE POSSE;;;PUBLICA;EMAE;620;;;;;Rua Dr. Nuno Guerner;-23.7058783239353;-46.6436770912383;;;;;;;;;;;;;;
RUA ABDO AMBUBA;;AMEACA DE REMOCAO;;SAO PAULO;CIDADE ADEMAR;SUL 2;Dados oficiais - Defensoria Publica de Santo Amaro;NAO;REINTEGRACAO DE POSSE;;;PUBLICA;CHRISTIANE  COPPOLA BOVE SANTO e outros;38;;;;;Rua Abdo Ambuba, sem numero, Vila Andrade - Sao Paulo/SP;-23.6784282989466;-46.6428169953302;;;;;;;;;;;;;;
BAIRRO ESCUDEIRO;;AMEACA DE REMOCAO;;SAO PAULO;CAPAO REDONDO;SUL 2;Dados oficiais - Defensoria Publica de Santo Amaro;NAO;REINTEGRACAO DE POSSE;;TERRENO VAZIO;PRIVADA;PAULISTA S/A;300;;;;;Rua Dr. Danton Marques, 17;-23.6947666772504;-46.796688651951;;;;;;;;;;;;;;
TEOTONIO VILELLA;;AMEACA DE REMOCAO;;SAO PAULO;CIDADE DUTRA;SUL 2;Dados oficiais - Defensoria Publica de Santo Amaro;NAO;REINTEGRACAO DE POSSE;;TERRENO VAZIO;PUBLICA;SITIO MONTESOL;200;;;;;Av. Senador Teotonio Vilela, 6400;-23.75324;-46.71147;;;;;;;;;;;;;;
PORTELINHA/OLGA BENARIO;;AMEACA DE REMOCAO;;SAO PAULO;GRAJAU;SUL 2;Dados oficiais - Defensoria Publica de Santo Amaro;NAO;REINTEGRACAO DE POSSE;;TERRENO VAZIO;PUBLICA;CDHU;300;;;;;Rua Ana Aslan, s/n;-23.7495382615534;-46.6806773920811;;;;;;;;;;;;;;
MBOI MIRIM;;AMEACA DE REMOCAO;;SAO PAULO;VILA ANDRADE;SUL 2;Dados oficiais - Defensoria Publica de Santo Amaro;NAO;REINTEGRACAO DE POSSE;;;PRIVADA;PEDRO BASILE;200;;;;;Estrada do M’Boi Mirim, 5650;-23.692908; -46.778296;;;;;;;;;;;;;;
PQ. COLONIAL;;AMEACA DE REMOCAO;;SAO PAULO;JARDIM ANGELA;SUL 2;Dados oficiais - Defensoria Publica de Santo Amaro;NAO;REINTEGRACAO DE POSSE;;;PRIVADA;ROSINA SIMONE SCARELLI GARRUBBA;25;;;;;Rua Zacarias de Gois, 371, Parque Colonial - Sao Paulo/SP;-23.7479079643329;-46.7840578150327;;;;;;;;;;;;;;
PARQUE REGINA;;AMEACA DE REMOCAO;;SAO PAULO;VILA ANDRADE;SUL 2;Dados oficiais - Defensoria Publica de Santo Amaro;NAO;REINTEGRACAO DE POSSE;;;PRIVADA;ELETROPAULO;63;;;;;Rua Professor Leitao da Cunha, 265;-23.6249279789837;-46.7363572039054;;;;;;;;;;;;;;
MAJOR LUCIO DIAS RAMOS;;AMEACA DE REMOCAO;;SAO PAULO;CIDADE DUTRA;SUL 2;Dados oficiais - Defensoria Publica de Santo Amaro;NAO;REINTEGRACAO DE POSSE;;;PRIVADA;SERGIO C. DONATO E MARIA LUCIA DONATO;30;;;;;Rua Major Lucio dias Ramos, 05;-23.7536481762642;-46.7119175355777;;;;;;;;;;;;;;
PIRAJUSSARA;;AMEACA DE REMOCAO;;SAO PAULO;JARDIM ANGELA;SUL 2;Dados oficiais - Defensoria Publica de Santo Amaro;NAO;REINTEGRACAO DE POSSE;;;PRIVADA;CDHU;26;;;;;Rua Almada Negreiros, Valo Velho - Sao Paulo/SP;-23.6987879283157;-46.7798276319742;;;;;;;;;;;;;;
MAJOR LUCIO DIAS RAMOS 2;;AMEACA DE REMOCAO;;SAO PAULO;CAMPO BELO;SUL 1;Dados oficiais - Defensoria Publica de Santo Amaro;NAO;REINTEGRACAO DE POSSE;;;PRIVADA;SERGIO COLELLA NONATO;30;;;;;Rua Major Lucio dias Ramos, 5;-23.629288151161;-46.6773869739686;;;;;;;;;;;;;;
DINO FAUSTO;;AMEACA DE REMOCAO;;SAO PAULO;CIDADE ADEMAR;SUL 2;Dados oficiais - Defensoria Publica de Santo Amaro;NAO;REINTEGRACAO DE POSSE;;;PRIVADA;GERMANO AIRES FERREIRA;30;;;;;Rua Professor Dino Fausto de Fontana, 200;-23.67942;-46.65134;;;;;;;;;;;;;;
JARDIM UBIRAJARA;;AMEACA DE REMOCAO;;SAO PAULO;CAMPO GRANDE;SUL 2;Dados oficiais - Defensoria Publica de Santo Amaro;NAO;REINTEGRACAO DE POSSE;;;PUBLICA;IGREJA TENRIKYO MEGUMU FUKYOSHO;8;;;;;Rua Jose Fugulin, 620;-23.687042;-46.670861;;;;;;;;;;;;;;
ESTRADA DE ITAPECIRICA;;AMEACA DE REMOCAO;;SAO PAULO;CAMPO LIMPO;SUL 2;Dados oficiais - Defensoria Publica de Santo Amaro;NAO;REINTEGRACAO DE POSSE;;TERRENO VAZIO;PUBLICA;MC HUANG E JACK SUN CHU HUANG;2500;;;;;Estrada de Itapecerica, 9999, Capao Redondo - Sao Paulo/SP;-23.6370079377205;-46.7550873219871;;;;;;;;;;;;;;
JD. AMERICANOPOLIS;;AMEACA DE REMOCAO;;SAO PAULO;CIDADE ADEMAR;SUL 2;Dados oficiais - Defensoria Publica de Santo Amaro;NAO;REINTEGRACAO DE POSSE;;;PRIVADA;J & N ADMINISTRACAO DE BENS PROPRIOS LTDA;56;;;;;Rua Marco Gagliano, 55, Americanopolis - Sao Paulo/SP;-23.675490;-46.642768;;;;;;;;;;;;;;
JOAO MAXIMILIANO;;AMEACA DE REMOCAO;;SAO PAULO;JARDIM SAO LUIS;SUL 2;Dados oficiais - Defensoria Publica de Santo Amaro;NAO;REINTEGRACAO DE POSSE;;;PRIVADA;CDHU;40;;;;;Rua Joao Maximiano, 620;-23.6619980039557;-46.7405573456875;;;;;;;;;;;;;;
PARQUE SAO MIGUEL 2;;AMEACA DE REMOCAO;;SAO PAULO;GRAJAU;SUL 2;Dados oficiais - Defensoria Publica de Santo Amaro;NAO;REINTEGRACAO DE POSSE;;TERRENO VAZIO;;;1000;;;;;Rua Alziro Pinheiro Magalhaes, sem numero, Pq. Sao Miguel - Sao Paulo/SP;-23.7562;-46.68544;;;;;;;;;;;;;;
COMUNIDADE CAI CAI ;;AMEACA DE REMOCAO;;SAO PAULO;JARDIM SAO LUIS;SUL 2;Dados oficiais - Defensoria Publica de Santo Amaro;NAO;AREA DE RISCO;;;PUBLICA;;70;;;;;Avenida Hamilton, Guarapiranga, Sao Paulo - SP;-23.6645280149613;-46.7375773418397;;;;;;;;;;;;;;
JD. LETICIA;;AMEACA DE REMOCAO;;SAO PAULO;GRAJAU;SUL 2;Dados oficiais - Defensoria Publica de Santo Amaro;NAO;REINTEGRACAO DE POSSE;;TERRENO VAZIO;PRIVADA;;220;;;;;Rua Nova do Tuparoquera, 2313;-23.770768281553;-46.6809974650949;;;;;;;;;;;;;;
COMUNIDADE PINHEIRAL;;AMEACA DE REMOCAO;;SAO PAULO;CAPAO REDONDO;SUL 2;Dados oficiais - Defensoria Publica de Santo Amaro;NAO;REINTEGRACAO DE POSSE;A justificativa e uma Acao Coletiva. Isso conta como ameaca de remocao?;;PRIVADA;;100;;;;;Atras do Hospital do Mboi Mirim;-23.6615978720654;-46.7866975353471;;;;;;;;;;;;;;
JD. DAS FLORES;;AMEACA DE REMOCAO;;SAO PAULO;JARDIM SAO LUIS;SUL 2;Dados oficiais - Defensoria Publica de Santo Amaro;NAO;REINTEGRACAO DE POSSE;A justificativa e uma Acao Coletiva. Isso conta como ameaca de remocao?;TERRENO VAZIO;PUBLICA;;45;;;;;Conjunto Residencial M'Boi Mirim, 152;-23.6571649403427;-46.7437988348018;;;;;;;;;;;;;;
COMUNIDADE MADIOCAL 2 - PQ REGINA;;AMEACA DE REMOCAO;;SAO PAULO;PEDREIRA;SUL 2;Dados oficiais - Defensoria Publica de Santo Amaro;NAO;REINTEGRACAO DE POSSE;;;PUBLICA;ELETROPAULO;;;;;;Rua Zacarias Dias Cortez, Rua Baltazar Veloso da Silva, Rua Bernardo Correia Leitao, Rua Bernardo Cunha Liet, Rua Prof. Leitao da Cunha, Rua Prof. Leitao de Araujo , Pq. Regina - Sao Paulo/SP;-23.692562833753;-46.6513539682223;;;;;;;;;;;;;;
VILA BOM JARDIM;;AMEACA DE REMOCAO;;SAO PAULO;JARDIM ANGELA;SUL 2;Dados oficiais - Defensoria Publica de Santo Amaro;NAO;REINTEGRACAO DE POSSE;;TERRENO VAZIO;PUBLICA;;250;;;;;Rua da Concordancia, Vila Bom Jardim - Sao Paulo/SP;-23.68536;-46.76031;;;;;;;;;;;;;;
JARDIM SAO LUIS;;AMEACA DE REMOCAO;;SAO PAULO;CAPAO REDONDO;SUL 2;Dados oficiais - Defensoria Publica de Santo Amaro;NAO;REINTEGRACAO DE POSSE;;TERRENO VAZIO;PUBLICA;CDHU;9;;;;;Rua Augusto Fabrigas , Jd. Novo Santo Amaro - Sao Paulo/SP;-23.6663579076664;-46.7758575064898;;;;;;;;;;;;;;
JD. TOCA;;AMEACA DE REMOCAO;;SAO PAULO;CAPAO REDONDO;SUL 2;Dados oficiais - Defensoria Publica de Santo Amaro;NAO;REINTEGRACAO DE POSSE;;TERRENO VAZIO;PRIVADA;EMAE;500;;;;;Rua Ieda Santos Delgado, Rua Antonio Carlos  Monteiro Teixeira e Canal do Ribeirao Cocaia, Bairros Jd. Ganhembu e Ribeirao Cocaia - Sao Paulo/SP;-23.6619378755364;-46.7855975319389;;;;;;;;;;;;;;
RUA CAMPO NOVO DO SUL;;AMEACA DE REMOCAO;;SAO PAULO;CAMPO LIMPO;SUL 2;Dados oficiais - Defensoria Publica de Santo Amaro;NAO;REINTEGRACAO DE POSSE;;TERRENO VAZIO;PUBLICA;DAVI ZAPATEIRO E OUTROS;8;;;;;Rua Campo Novo do Sul, quadra 15, lotes 14 e 15, Vila Andrade - Sao Paulo/SP;-23.637567943061;-46.7534073169091;;;;;;;;;;;;;;
RUA DOS CATARINENSES;;AMEACA DE REMOCAO;;SAO PAULO;CAMPO LIMPO;SUL 2;Dados oficiais - Defensoria Publica de Santo Amaro;NAO;REINTEGRACAO DE POSSE;;;PRIVADA;REGIMAR COMERCIAL S/A;86;;;;;Rua dos Catarinenses, 22, Quadra 35, Vila Andrade - Sao Paulo/SP;-23.6207479390136;-46.748937242005;;;;;;;;;;;;;;
COMUNIDADE CIDADE MADEIRA;;AMEACA DE REMOCAO;;SAO PAULO;JARDIM ANGELA;SUL 2;Dados oficiais - Defensoria Publica de Santo Amaro;NAO;REINTEGRACAO DE POSSE;;TERRENO VAZIO;PRIVADA;MIMAX;400;;;;;Terreno situado no Bairro de Tuparoquera, parte dos lotes 1-A e 8-A da fazenda ITUPU;-23.6857679699012;-46.7607575092374;;;;;;;;;;;;;;
VILA ANDRADE;;AMEACA DE REMOCAO;;SAO PAULO;JABAQUARA;SUL 1;Dados oficiais - Defensoria Publica de Santo Amaro;NAO;REINTEGRACAO DE POSSE;;TERRENO VAZIO;PRIVADA;CDHU;56;;;;;Rua Chapada de Minas, s/n, e Canto do Rio Verde, s/n, Parque Reboucas - Sao Paulo/SP;-23.6521882925999;-46.6357968780198;;;;;;;;;;;;;;
RECANTO DOS PASSAROS;;AMEACA DE REMOCAO;;SAO PAULO;CIDADE DUTRA;SUL 2;Dados oficiais - Defensoria Publica de Santo Amaro;NAO;REINTEGRACAO DE POSSE;;TERRENO VAZIO;PRIVADA;EMAE;300;;;;;Rua Manoel Teffe;-23.69918;-46.69226;;;;;;;;;;;;;;
VILA ANDRADE;;AMEACA DE REMOCAO;;SAO PAULO;JARDIM SAO LUIS;SUL 2;Dados oficiais - Defensoria Publica de Santo Amaro;NAO;REINTEGRACAO DE POSSE;;TERRENO VAZIO;PUBLICA;CETEEP;;;;;;"Rua Alexandre Archipenko; Rua Canto Bonito; Rua Campo Novo do Sul";-23.6575179852865;-46.7455473513126;;;;;;;;;;;;;;
COHAB ADVENTISTA;;AMEACA DE REMOCAO;;SAO PAULO;CAMPO GRANDE;SUL 2;Dados oficiais - Defensoria Publica de Santo Amaro;NAO;REINTEGRACAO DE POSSE;;TERRENO VAZIO;PUBLICA;COHAB;16;;;;;Rua Integrada, 150, Rua Modelar e Travessa Aroeira da Praia, Lotes 1, 17, 18, 19 e 20 da Quadra 3-B, Conjunto Habitacional Adventista - Sao Paulo/SP;-23.6878382270215;-46.671337145444;;;;;;;;;;;;;;
JARDIM SAO LUIS;;AMEACA DE REMOCAO;;SAO PAULO;CAPAO REDONDO;SUL 2;Dados oficiais - Defensoria Publica de Santo Amaro;NAO;REINTEGRACAO DE POSSE;;TERRENO VAZIO;PUBLICA;EMAE;114;;;;;Rua Jose Joaquim Esteves, com a Travessa do Carteiro, Jardim Sao Luiz - Sao Paulo/SP;-23.6858078547767;-46.8011276764017;;;;;;;;;;;;;;
MANGUE SECO/GRAJAU;;AMEACA DE REMOCAO;;SAO PAULO;GRAJAU;SUL 2;Dados oficiais - Defensoria Publica de Santo Amaro;NAO;REINTEGRACAO DE POSSE;;TERRENO VAZIO;PUBLICA;CDHU;800;;;;;Rua Quatro na altura da Rua Tarasca e Ave-Capuchinha, Jardim Sao Judas Tadeu - Sao Paulo/SP;-23.6364779791852;-46.7403372591206;;;;;;;;;;;;;;
JD. MIRIAM;;AMEACA DE REMOCAO;;SAO PAULO;CIDADE ADEMAR;SUL 2;Dados oficiais - Defensoria Publica de Santo Amaro;NAO;REINTEGRACAO DE POSSE;;TERRENO VAZIO;PRIVADA;ELETROPAULO;50;;;;;Rua  Marguerita Alves, Rua Oleoduto, Rua Elizabete Linley, Travessa Recordacoes de Tramataia, Rua Rubens Luccats, Av. Cupece n. 5100;-23.6758882943488;-46.6435369897857;;;;;;;;;;;;;;
JARDIM GUARUJA;;AMEACA DE REMOCAO;;SAO PAULO;GRAJAU;SUL 2;Dados oficiais - Defensoria Publica de Santo Amaro;NAO;REINTEGRACAO DE POSSE;;TERRENO VAZIO;PRIVADA;MARIA LUIZA GOMES SILVA E SOUZA E OUTROS;7;;;;;Estrada Paudalhos, Lote 36, Quadra 23, Jardim Guaruja - Sao Paulo/SP;-23.7551183242559;-46.6606773278584;;;;;;;;;;;;;;
JARDIM HORIZONTE AZUL;;AMEACA DE REMOCAO;;SAO PAULO;CAMPO LIMPO;SUL 2;Dados oficiais - Defensoria Publica de Santo Amaro;NAO;REINTEGRACAO DE POSSE;;TERRENO VAZIO;PRIVADA;ANTONIO PIETROFORTE;28;;;;;Rua Tio Antonio, Rua Projetada, Travessa Sao Francisco e Rua Julio Pestrino (Antiga Acre), Jardim Horizonte Azul - Sao Paulo/SP;-23.6372179682504;-46.7444372785862;;;;;;;;;;;;;;
VILA ANDRADE;;AMEACA DE REMOCAO;;SAO PAULO;GRAJAU;SUL 2;Dados oficiais - Defensoria Publica de Santo Amaro;NAO;REINTEGRACAO DE POSSE;;;PUBLICA;CDHU;21;;;;;R. Campo Novo do Sul, 101, esquina com R. Alexandre Benois, Vila Andrade - Sao Paulo/SP;-23.7393382183534;-46.6922674057746;;;;;;;;;;;;;;
JARDIM ANGELA;;AMEACA DE REMOCAO;;SAO PAULO;GRAJAU;SUL 2;Dados oficiais - Defensoria Publica de Santo Amaro;NAO;REINTEGRACAO DE POSSE;;TERRENO VAZIO;PUBLICA;CDHU;100;;;;;Estrada do M'Boi Mitim, 5650 (Rua Bonifacio Pasquali, Rua Geronimo de Souza Lobo e Rua Inacio Pereira Neves), Jardim Fujihara - Sao Paulo/SP;-23.7566082536247;-46.6858874375717;;;;;;;;;;;;;;
FAVELA JOAO ALVES CARNEIRO;;AMEACA DE REMOCAO;;SAO PAULO;JARDIM SAO PAULO;SUL 2;Dados oficiais - Defensoria Publica de Santo Amaro;NAO;REINTEGRACAO DE POSSE;;TERRENO VAZIO;PUBLICA;CDHU;3000;;;;;Rua Cornelio Zelaia x Rua Joao Gomes Carneiro, LOTE 23 e 24 da QUADRA 16;-23.65707;-46.74296;;;;;;;;;;;;;;
JARDIM SANTA LUCIA;;AMEACA DE REMOCAO;;SAO PAULO;CAPAO REDONDO;SUL 2;Dados oficiais - Defensoria Publica de Santo Amaro;NAO;REINTEGRACAO DE POSSE;;;PRIVADA;SERGIO CANESTRELLI;35;;;;;Rua Joaquim Lourenco Toledo de Bueno, Jardim Santa Lucia;-23.6615978720654;-46.7866975353471;;;;;;;;;;;;;;
JARDIM SAO RAFAEL;;AMEACA DE REMOCAO;;SAO PAULO;JARDIM SAO LUIS;SUL 2;Dados oficiais - Defensoria Publica de Santo Amaro;NAO;REINTEGRACAO DE POSSE;;TERRENO VAZIO;PUBLICA;CDHU;300;;;;;Rua Francisco Correia Vasques, Jardim Sao Rafael - Sao Paulo/SP;-23.6819780101377;-46.7453374326343;;;;;;;;;;;;;;
SANTO AMARO;;AMEACA DE REMOCAO;;SAO PAULO;JARDIM SAO LUIS;SUL 2;Dados oficiais - Defensoria Publica de Santo Amaro;NAO;REINTEGRACAO DE POSSE;;TERRENO VAZIO;PUBLICA;CTEEP;14;;;;;"Rua Sao Pedro; Rua Tupi; Rua Rio Branco; Estrada da Ligacao; Jd. Monte Verde - Sao Paulo/SP";-23.6658879925124;-46.7459273809993;;;;;;;;;;;;;;
COCAIA;;AMEACA DE REMOCAO;;SAO PAULO;CAMPO LIMPO;SUL 2;Dados oficiais - Defensoria Publica de Santo Amaro;NAO;REINTEGRACAO DE POSSE;;;PRIVADA;JORGE MASTAKA ONODA;;;;;;;;;;;;;;;;;;;;;;
MAX BECKMANN;;AMEACA DE REMOCAO;;SAO PAULO;GRAJAU;SUL 2;Dados oficiais - Defensoria Publica de Santo Amaro;NAO;REINTEGRACAO DE POSSE;;TERRENO VAZIO;PUBLICA;CDHU;9;;;;;Rua Max Beckmann, Capelinha - Sao Paulo/SP;-23.770768281553;-46.6809974650949;;;;;;;;;;;;;;
JARDIM NOVO SANTO AMARO;;AMEACA DE REMOCAO;;SAO PAULO;JARDIM SAO LUIS;SUL 2;Dados oficiais - Defensoria Publica de Santo Amaro;NAO;REINTEGRACAO DE POSSE;;TERRENO VAZIO;;;250;;;;;Ruas Jose Barros Magaldi, Alessandro Scarlatti e Nova do Tuparoquera, Jardim Sao Luis - Sao Paulo/SP;-23.6685780239424;-46.7358373482367;;;;;;;;;;;;;;
ALMIRANTE NEGRO;;AMEACA DE REMOCAO;43 familias seguem que habitam o edificio no centro de Sao Paulo seguem ameacadas de remocao por reintegracao de posse. A remocao estava para acontecer em dezembro de 2019 mas foi suspensa;SAO PAULO;SE;CENTRO;Denuncia via parceiros do Observatorio de Remocoes;NAO;REINTEGRACAO DE POSSE;;EDIFICACAO;;;43;;;;2018;Rua Carlos de Sousa Nazare, 630;-23.540008; -46.628054;;;;;;;;;;;;;;
JARDIM NOVA HEBRON;;AMEACA DE REMOCAO;;SAO PAULO;TREMEMBE;NORTE 1;Dados oficiais -  Nucleo Especializado de Habitacao e Urbanismo da Defensoria Publica do Estado;NAO;AREA DE RISCO;;TERRENO VAZIO;;;136;;;;;Area entre a Rua Tereza Carreno, Rua Bahia e Rua Mirante Gomes;-23.446454;-46.580900;;;;;;;;;;;;;;
VILA NOVA GALVAO;;AMEACA DE REMOCAO;Ameaca sobre casas localizadas na faixa de dominio da Rodovia Fernao Dias, ao total, sao seis processos que incidem sobre uma area de 9 km, do km 77 ao 86 da Rodovia. Algumas casas estao no local ha 50 anos;SAO PAULO;JACANA;NORTE 1;Dados oficiais - Defensoria Pubica da Uniao;NAO;FAIXA DE DOMINIO DE RODOVIA;;TERRENO VAZIO;PUBLICA;;;;;;1970;KM 77 ao 86 da Rodovia Fernao Dias;-23.437092;-46.567913;;;;;;;;;;;;;;
VILA NOVA GALVAO;;AMEACA DE REMOCAO;;SAO PAULO;TREMEMBE;NORTE 1;Dados oficiais - Defensoria Publica de Santana;NAO;REINTEGRACAO DE POSSE;;TERRENO VAZIO;PRIVADA;;;;;;;Rua Projetada, s/nº, Vila Nova Galvao, Sao Paulo/SP;-23.447072;-46.567852;;;;;;;;;;;;;;
BARROCADA;;AMEACA DE REMOCAO;;SAO PAULO;TREMEMBE;NORTE 1;Dados oficiais - Defensoria Publica de Santana;NAO;REINTEGRACAO DE POSSE;;TERRENO VAZIO;PRIVADA;;;;;;;Estrada da Barrocada, nº 1903, Tremembe, Sao Paulo-SP;-23.406329;-46.577076;;;;;;;;;;;;;;
OCUPACAO NOVA LARANJEIRAS;;AMEACA DE REMOCAO;A ocupacao Nova Laranjeiras, localizada no Jardim Iguatemi, Zona Leste de Sao Paulo, pode ser removida por conta de uma acao de reintegracao de posse, marcada para o dia 21 de outubro. Tratam-se de aproximadamente 30 mil pessoas, sendo que quase metade delas formada por criancas e adolescentes. As familia ocupam uma area particular, com algumas partes demarcadas como area de protecao ambiental. A area pode ser considerada uma das maiores ocupacoes da America Latina.;SAO PAULO;IGUATEMI;LESTE 2;Denuncia via parceiros do Observatorio de Remocoes;NAO;REINTEGRACAO DE POSSE;;TERRENO VAZIO;PRIVADA;;10000;;;;;;-23.599391;-46.427731 ;;;;;;;;;;;;;;
JUNDIAPEBA;;AMEACA DE REMOCAO;459 familias protestam contra acao de reintegracao de posse em Jundiapeba. A empresa que move o pedido de reintegracao de posse e a CTEEP. A area ja havia sofrido a remocao parcial de 70 familias em maio de 2018.;MOGI DAS CRUZES;;RMSP;Clipping;NAO;REINTEGRACAO DE POSSE;;TERRENO VAZIO;PRIVADA;CTEEP;459;;"Movimento ""Moradia para Jundiapeba""";;;Rua Equador, 36;-23.546467; -46.242149;;;;;;;;;;;;;;
OCUPACAO DOS QUEIXADAS;;AMEACA DE REMOCAO;Ameaca de remocao da ocupacao a partir de ordem de reintegracao de posse que corre em segredo de justica. Terreno ja havia sido alvo de reintegracao de posse em 2018, sendo reocupado.;SAO PAULO;ANHANGUERA;Norte 2;Denuncia via parceiros do Observatorio de Remocoes;NAO;REINTEGRACAO DE POSSE;;TERRENO VAZIO;PRIVADA;;300;;FLM;;2018;R. Aloisio Magalhaes, 14;-23.418652;-46.805964;"<p style=""font-size: 13px; font-weight: normal; margin: 5px; color: #4A4A4A;"">     <a href=""https://www.facebook.com/226163017577531/posts/1037213019805856?s=100001918035752&sfns=mo"" target=""_blank""style=""font-weight: bold; color: #1CAAD9;"">Clique aqui para ler mais</a>";;;;;;;;;;;;;
DUQUE DE CAXIAS 825;;AMEACA DE REMOCAO;Ameaca de remocao a partir de processo de reintegracao de posse previsto a atingir 30 familias moradoras de um cortico localizado na regiao central da cidade de Sao Paulo;SAO PAULO;REPUBLICA;Centro;Denuncia via parceiros do Observatorio de Remocoes;NAO;REINTEGRACAO DE POSSE;;EDIFICACAO;PRIVADA;;30;;;ZC;;Avenida Duque de Caxias, 826;-23.53623699;-46.64177209;;;;;;;;;;;;;;
VILA NOVA AMERICA;;AMEACA DE REMOCAO;;SAO BERNARDO DO CAMPO;;ABC;Denuncia via parceiros do Observatorio de Remocoes - Rede Contra Remocoes ABC;NAO;AREA DE PROTECAO AMBIENTAL;;TERRENO VAZIO;;;400;;;;;;-23.7457044;-46.5975096;;;;;;;;;;;;;;
BIQUINHA;;AMEACA DE REMOCAO;Passaram por alguns processos de reintegracao de posse (principalmente a area de cima do morro, porem a area sempre voltou a ser ocupada.;SAO BERNARDO DO CAMPO;;ABC;Denuncia via parceiros do Observatorio de Remocoes - Rede Contra Remocoes ABC;NAO;AREA DE RISCO;;TERRENO VAZIO;PRIVADA;;45;;;;1990;Rua Isa Maria;-23.73099;-46.53170;;;;;;;;;;;;;;
JARDIM DAS OLIVEIRAS;;AMEACA DE REMOCAO;Nao ha muitas informacoes. A denuncia relata que a ameaca se deu por conta de restricoes ambientais acerca da poluicao da pluma;SAO BERNARDO DO CAMPO;;ABC;Denuncia via parceiros do Observatorio de Remocoes - Rede Contra Remocoes ABC;NAO;AREA DE PROTECAO AMBIENTAL;;;;;;;;;;Estrada da Cama Patente;-23.75181;-46.59200;;;;;;;;;;;;;;
PQ. ESTORIL;;AMEACA DE REMOCAO;;SAO BERNARDO DO CAMPO;;ABC;Denuncia via parceiros do Observatorio de Remocoes - Rede Contra Remocoes ABC;NAO;REINTEGRACAO DE POSSE;;TERRENO VAZIO;;;;;;;;Rua Cintra;-23.7761;-46.52175;;;;;;;;;;;;;;
1001;;AMEACA DE REMOCAO;Ordem judicial;SAO BERNARDO DO CAMPO;;ABC;Denuncia via parceiros do Observatorio de Remocoes -  Rede Contra Remocoes ABC;NAO;AREA DE PROTECAO AMBIENTAL;;TERRENO VAZIO;PRIVADA;;700;;MTST;;;Av. 11;-23.74031;-46.60887;;;;;;;;;;;;;;
FAVELA NOVA ESPERANCA;;AMEACA DE REMOCAO;Favela Nova Esperanca,  em Paraisopolis, segue sob ameaca de remocao. Na Avenida Hebe Camargo, atras do Cemiterio Morumbi, 05  familias ja  foram removidas e outras seguem ameacadas no local. Na Rua dos Simbolos, onde existem  mais de 100 casas, tambem ha ameacas da Subprefeitura de Campo Limpo.;SAO PAULO;VILA ANDRADE;SUL 2;Denuncia via parceiros do Observatorio de Remocoes;NAO;REINTEGRACAO DE POSSE;;TERRENO VAZIO;PUBLICA;;100;5;;;;Av. Hebe Camargo - Paraisopolis ;-23.621581 ;-46.725342 ;;;;;;;;;;;;;;
OCUPACAO NOVO RUMO;;AMEACA DE REMOCAO;Terreno, que estava abandonado e sem cumprir sua funcao social por anos, foi ocupado por cerca de 40 familias que residem no local ha, pelo menos, 5 anos;SAO PAULO;BUTANTA;OESTE;Denuncia via parceiros do Observatorio de Remocoes;NAO;REINTEGRACAO DE POSSE;;TERRENO VAZIO;PRIVADA;;40;;Brigadas Populares;;;;-23.57597;-46.73213;"<p style=""font-size: 13px; font-weight: normal; margin: 5px; color: #4A4A4A;"">     <a href=""https://www.youtube.com/watch?v=Rfku_He0NZ4"" target=""_blank""style=""font-weight: bold; color: #1CAAD9;"">Clique aqui para ler mais</a>";;;;;;;;;;;;;
OCUPACAO CAMPELO 368;;AMEACA DE REMOCAO;80 familias estao ameacadas de remocao, ocupam uma antiga Fabrica de Amendoin que foi abandonada.;SAO PAULO;TREMEMBE;NORTE 1;Denuncia via parceiros do Observatorio de Remocoes;NAO;REINTEGRACAO DE POSSE;;EDIFICACAO;PRIVADA;;80;;;;;Rua Campelo, 368;-23.46283;-46.60051;;;;;;;;;;;;;;
BELMIRA MARIN;;AMEACA DE REMOCAO;Diversas familias receberam um oficio de citacao para um processo de reintegracao de posse.;SAO PAULO;GRAJAU;SUL 2;Denuncia via parceiros do Observatorio de Remocoes;NAO;REINTEGRACAO DE POSSE;;TERRENO VAZIO;;;;;;;;Av. belmira marin, 45;-23.7550589;-46.6781542;;;;;;;;;;;;;;
ANGELICA;;AMEACA DE REMOCAO;Ameaca de remocao mapeada (sem atuacao) pelo Nucleo de Mediacao de Conflitos da Secretaria Municipal de Habitacao de Sao Paulo. Atraves de parceiros obtivemos a informacao que rocesso de reintegracao de posse marcado para o dia 31/07/2019.;SAO PAULO;SANTA CECILIA;CENTRO;Dados oficiais - Nucleo de Mediacao de Conflitos da Secretaria Municipal de Habitacao - Sao Paulo;NAO;REINTEGRACAO DE POSSE;;EDIFICACAO;PRIVADA;;8;;FLM;ZEU;2018;Avenida Angelica, 651, Se, Sao Paulo, SP, Brasil;-23.5387007;-46.6546743;;;;;;;;;;;;;;
OCUPACAO AQUALTUNE;;AMEACA DE REMOCAO;Ordem de regularizacao de posse concedida no dia 25 de novembro de 2017, risco iminente de despejo. As familias ja estao na regiao de Pinheiros ha 3 anos, ocupando o antigo Colegio Butanta.;SAO PAULO;PINHEIROS;OESTE;Denuncia via parceiros do Observatorio de Remocoes;NAO;REINTEGRACAO DE POSSE;;EDIFICACAO;PRIVADA;;35;;Terra Livre;;;Rua Butanta, 233;-23.569576;-46.697270;"<p style=""font-size: 13px; font-weight: normal; margin: 5px; color: #4A4A4A;"">     <a href=""https://www.redebrasilatual.com.br/cidadania/2017/10/ocupacao-em-pinheiros-faz-virada-cultural-contra-ameaca-de-reintegracao"" target=""_blank""style=""font-weight: bold; color: #1CAAD9;"">Clique aqui para ler mais</a>";;;;;;;;;;;;;
OCUPACAO DE MORADIA MARTINS FONTES;;AMEACA DE REMOCAO;Um dos imoveis ocupados esta localizado na Rua Martins Fontes, no Centro. Pela tabela do INSS, ele vale mais de seis milhoes de reais. Mesmo assim, estava sem uso, ate ser ocupado por 48 familias de cinco movimentos sociais em 2011. O orgao pediu a reintegracao de posse que esta suspensa no momento.;SAO PAULO;REPUBLICA;CENTRO;Clipping;NAO;REINTEGRACAO DE POSSE;;EDIFICACAO;PUBLICA;GOVERNO FEDERAL;50;;MMC;;;Rua Martins Fontes, 18;-23.549052;-46.644094;"<p style=""font-size: 13px; font-weight: normal; margin: 5px; color: #4A4A4A;"">     <a href=""https://g1.globo.com/sp/sao-paulo/noticia/mesmo-com-60-imoveis-vazios-inss-gasta-r-560-mil-por-mes-com-aluguel-em-sao-paulo.ghtml"" target=""_blank""style=""font-weight: bold; color: #1CAAD9;"">Clique aqui para ler mais</a>";;;;;;;;;;;;;
21 DE ABRIL;;AMEACA DE REMOCAO;Ocupacao de predio corre ameaca de remocao.;SAO PAULO;BRAS;LESTE 1;Dados oficiais - Visitas nas ocupacoes de moradia realizada pela PMSP;NAO;REINTEGRACAO DE POSSE;;EDIFICACAO;PRIVADA;;30;;;;;Rua 21 de Abril, 553 - Bras, Sao Paulo - State of Sao Paulo, Brazil;-23.5434411;-46.609712599999900;;;;;;;;;;;;;;
25 DE JANEIRO/2 DE JULHO;;AMEACA DE REMOCAO;A comunidade esta ameacada por estar localizada na faixa de dominio da Rodovia dos Imigrantes;DIADEMA;;ABC;Dados oficiais – Prefeitura de Diadema;SIM;FAIXA DE DOMINIO DE RODOVIA;;TERRENO VAZIO;PUBLICA;GOVERNO DO ESTADO;;;CMP;;;Travessa Vinte e Cinco de Janeiro, 12 - Canhema, Diadema - State of Sao Paulo, Brazil;-23.68186;-46.608236799999900;;;;;;;;;;;;;;
7 DE SETEMBRO/REI DO GADO;;AMEACA DE REMOCAO;A comunidade esta ameacada por estar localizada na faixa de dominio da Rodovia dos Imigrantes;DIADEMA;;ABC;Dados oficiais – Prefeitura de Diadema;SIM;FAIXA DE DOMINIO DE RODOVIA;;TERRENO VAZIO;PUBLICA;GOVERNO DO ESTADO;;;CMP;;;Rua Pau do Cafe, 763, Diadema - State of Sao Paulo, Brazil;-23.7024056;-46.6013408;;;;;;;;;;;;;;
ABACATEIRO;;AMEACA DE REMOCAO;Favela listada no banco de dados do Habitasampa e classificada como area de risco nivel 3 e/ou 4.;SAO PAULO;PEDREIRA;SUL 2;Dados oficiais – Habitasampa;NAO;AREA DE RISCO;Deslizamento / Solapamento;TERRENO VAZIO;;;87;;;ZEIS-1 | ZM;1967;Avenida Eduardo Pereira Ramos;-23.6888477127381;-46.6668588688369;;;;;;;;;;;;;;
AC. ESTRADA ANTIGA DO MAR;;AMEACA DE REMOCAO;Terreno ocupado por comunidade desde 1960 corre ameaca de remocao de suas 62 familias. A ocupacao se localiza em perimetro do projeto Renova SP.;SAO PAULO;JABAQUARA;SUL 1;Dados oficiais – Habisp;SIM;URBANIZACAO DE FAVELAS;;TERRENO VAZIO;PUBLICA;PREFEITURA;62;;;;;;-23.669922294035917;-46.63912932943043;;;;;;;;;;;;;;
